{
  "$schema": "https://json-schema.org/draft/2020-12/schema",
  "$id": "https://truchas.org/schema/flow_thermal_2d.schema.json",
  "title": "Truchas 2D coupled flow-thermal simulation input",
  "description": "Complete input for a two-dimensional non-isothermal flow simulation with thermal transport.",
  "type": "object",
  "properties": {
    "materials": {
      "$ref": "../../materials/materials.schema.json",
      "description": "Named material definitions used by the simulation. Without material-regions, define exactly one material."
    },
    "material-regions": {
      "$ref": "../../materials/material_regions.schema.json",
      "description": "Optional geometric or cell-set assignment of materials to the mesh."
    },
    "mesh": {
      "$ref": "../../mesh/mesh_2d.schema.json",
      "description": "Two-dimensional mesh definition."
    },
    "flow-model": {
      "$ref": "flow_thermal_flow_model.schema.json",
      "description": "Flow model and boundary conditions. The inertial setting is under solver.flow."
    },
    "ht-model": {
      "$ref": "../../physics/thermal/thermal_model.schema.json",
      "description": "Thermal model, including the advection-capable thermal boundary conditions and optional sources."
    },
    "solver": {
      "$ref": "flow_thermal_solver.schema.json",
      "description": "Coupled flow and thermal solver controls."
    },
  "initial-time": {
      "type": "number",
      "default": 0.0,
      "description": "Simulation time at which the initial flow and temperature states are established. The default is zero."
    },
  "output-times": {
      "$ref": "../../core/output_times.schema.json",
      "description": "Output schedule. At least one expanded output time must be later than initial-time."
    },
  "final-time": {
      "type": "number",
      "description": "Optional final simulation time. It must be greater than initial-time and no earlier than the last output time; if omitted, it equals the last output time."
    },
  "time-stepping": {
      "$ref": "flow_thermal_time_stepping.schema.json",
      "description": "Coupled-integrator time-step limits, synchronization, and retry controls."
    },
    "initial-velocity": {
      "$ref": "../../core/vector_func.schema.json",
      "description": "Optional initial velocity field. It may be a constant vector or inline vector function; it must evaluate to exactly two components. If omitted, the initial velocity is zero."
    },
    "initial-temperature": {
      "$ref": "../../core/scalar_func.schema.json",
      "description": "Initial temperature field. It may be a constant or inline scalar function projected to mesh cell centers."
    }
  },
  "required": [
    "materials",
    "mesh",
    "flow-model",
    "ht-model",
    "solver",
    "output-times",
    "time-stepping",
    "initial-temperature"
  ],
  "additionalProperties": false,
  "allOf": [
    {
      "if": {
        "not": { "required": ["material-regions"] }
      },
      "then": {
        "properties": {
          "materials": {
            "maxProperties": 1
          }
        }
      }
    },
    {
      "if": {
        "properties": {
          "flow-model": {
            "properties": {
              "inviscid": { "const": true }
            },
            "required": ["inviscid"]
          }
        },
        "required": ["flow-model"]
      },
      "else": {
        "properties": {
          "solver": {
            "properties": {
              "flow": {
                "required": ["momentum-solver"]
              }
            }
          }
        }
      }
    },
    {
      "not": {
        "properties": {
          "flow-model": {
            "properties": { "inviscid": { "const": true } },
            "required": ["inviscid"]
          },
          "solver": {
            "properties": {
              "flow": {
                "properties": { "inertial": { "const": false } },
                "required": ["inertial"]
              }
            },
            "required": ["flow"]
          }
        },
        "required": ["flow-model", "solver"]
      }
    }
  ]
}
