{
    "materials": {
        "air": {
            "properties": {
                "fluid": true,
                "conductivity": 2.5470e-5,
                "density": 1.2180,
                "specific-heat": 1.006,
                "viscosity": 1.7975845e-5,
                "thermal-expan-coef": 0.00328407224959,
                "expan-ref-temp": 0.0
            }
        }
    },
    "mesh": {
        "x-axis": {"coarse-grid": [0.0, 1.0], "intervals": [49]},
        "y-axis": {"coarse-grid": [0.0, 1.0], "intervals": [49]}
    },
    "flow-model": {
        "body-acceleration": [0.0, -9.34142216e-5],
        "bc": {
            "walls": {"type": "no-slip", "face-set-ids": [1, 2, 3, 4]}
        }
    },
    "ht-model": {
        "bc": {
            "left": {"type": "temperature", "face-set-ids": [1], "temp": 2.0},
            "right": {"type": "temperature", "face-set-ids": [2], "temp": 1.0},
            "top-bottom": {"type": "flux", "face-set-ids": [3, 4], "flux": 0.0}
        },
        "source": {}
    },
    "solver": {
      "flow": {
            "courant-number": 0.5,
            "momentum-solver": {"rel-tol": 1.0e-8, "abs-tol": 1.0e-10,
                "max-ds-iter": 50, "max-amg-iter": 25},
            "projection-solver": {"rel-tol": 0.0, "abs-tol": 1.0e-12,
                "max-ds-iter": 50, "max-amg-iter": 25}
        },
      "thermal": {
            "preconditioner": {"method": "BoomerAMG", "params": {"num-cycles": 1}},
            "error-norm": {"abs-t-tol": 0.0, "rel-t-tol": 1.0e-4, "rel-h-tol": 1.0e-4},
            "integrator": {"use-backward-euler": true, "nlk-max-iter": 10, "nlk-tol": 0.05}
        }
    },
    "initial-time": 0.0,
    "output-times": {"times": [1000.0, 30000.0] },
    "time-stepping": {
      "initial-time-step": 1.0e-2,
      "min-time-step": 1.0e-5,
      "max-time-step": 1.0e3,
      "time-step-growth": 1.05
    },
    "initial-temperature": {
        "type": "tabular",
        "tabular x": [0.0, 1.0],
        "tabular y": [2.0, 1.0]
    },
    "initial-velocity": [0.0, 0.0]
}
